<?xml version="1.0" encoding="UTF-8"?>
<!--Archivo XML de muestra generado con XMLSpy v2022 rel. 2 (x64) (http://www.altova.com)-->
<?xml-stylesheet type="text/xsl" href="inventario.xsl"?>
<inventario xmlns:xsi="http://www.w3.org/2001/XMLSchema-instance" xsi:noNamespaceSchemaLocation="inventario.xsd">
  <pantallas>
    <pantalla>
      <n_serie>ABC1234</n_serie>
      <fecha_alta>1957-08-13</fecha_alta>
      <pulgadas>17</pulgadas>
      <ubicacion>
        <cod_ubicacion>String</cod_ubicacion>
        <nombre>String</nombre>
        <planta>primera</planta>
        <superficie>String</superficie>
      </ubicacion>
    </pantalla>
    <pantalla>
      <n_serie>ABC1234</n_serie>
      <fecha_alta>1957-08-13</fecha_alta>
      <pulgadas>17</pulgadas>
      <ubicacion>
        <cod_ubicacion>String</cod_ubicacion>
        <nombre>String</nombre>
        <planta>primera</planta>
        <superficie>String</superficie>
      </ubicacion>
    </pantalla>
    <pantalla>
      <n_serie>ABC1234</n_serie>
      <fecha_alta>1957-08-13</fecha_alta>
      <pulgadas>17</pulgadas>
      <ubicacion>
        <cod_ubicacion>String</cod_ubicacion>
        <nombre>String</nombre>
        <planta>primera</planta>
        <superficie>String</superficie>
      </ubicacion>
    </pantalla>
  </pantallas>
  <ordenadores>
    <ordenador>
      <n_serie>ABC8888</n_serie>
      <cpu>i5_9gen</cpu>
      <memoriaRAM>16GB</memoriaRAM>
      <ubicacion>
        <cod_ubicacion>String</cod_ubicacion>
        <nombre>String</nombre>
        <planta>primera</planta>
        <superficie>String</superficie>
      </ubicacion>
      <fecha_alta>1969-08-13</fecha_alta>
      <precio>10001</precio>
    </ordenador>
    <ordenador>
      <n_serie>ABC1234</n_serie>
      <cpu>i3_9gen</cpu>
      <memoriaRAM>32GB</memoriaRAM>
      <ubicacion>
        <cod_ubicacion>String</cod_ubicacion>
        <nombre>nuevo</nombre>
        <planta>tercera</planta>
        <superficie>String</superficie>
      </ubicacion>
      <fecha_alta>1957-08-13</fecha_alta>
      <precio>20000</precio>
    </ordenador>
    <ordenador>
      <n_serie>ABC4321</n_serie>
      <cpu>i5_9gen</cpu>
      <memoriaRAM>16GB</memoriaRAM>
      <ubicacion>
        <cod_ubicacion>String</cod_ubicacion>
        <nombre>String</nombre>
        <planta>primera</planta>
        <superficie>String</superficie>
      </ubicacion>
      <fecha_alta>1957-08-13</fecha_alta>
      <precio>50</precio>
    </ordenador>
  </ordenadores>
  <portatiles>
    <portatil SO="Windows">
      <n_serie>ABC1234</n_serie>
      <cpu>i3_9gen</cpu>
      <pulgadas>19</pulgadas>
      <cod_ubicacion>String</cod_ubicacion>
    </portatil>
    <portatil SO="Linux">
      <n_serie>PRT2233</n_serie>
      <cpu>i3_9gen</cpu>
      <pulgadas>13</pulgadas>
      <cod_ubicacion>escaparate</cod_ubicacion>
    </portatil>
    <portatil SO="Otro">
      <n_serie>ABC1234</n_serie>
      <cpu>i3_9gen</cpu>
      <pulgadas>17</pulgadas>
      <cod_ubicacion>almacen3</cod_ubicacion>
    </portatil>
  </portatiles>
  <ubicaciones>
    <ubicacion>
      <cod_ubicacion>almacen3</cod_ubicacion>
      <nombre>String</nombre>
      <planta>tercera</planta>
      <superficie>String</superficie>
    </ubicacion>
    <ubicacion>
      <cod_ubicacion>escaparate</cod_ubicacion>
      <nombre>escaparatuco</nombre>
      <planta>primera</planta>
      <superficie>grande</superficie>
    </ubicacion>
    <ubicacion>
      <cod_ubicacion>String</cod_ubicacion>
      <nombre>String</nombre>
      <planta>primera</planta>
      <superficie>String</superficie>
    </ubicacion>
  </ubicaciones>
</inventario>
